{
  "$schema":"https://json-schema.org/draft/2020-12/schema","type":"object","required":["schema_version","contract_id","contract_version","run_id","case_id","stage","attempt","idempotency_key","status","started_at","completed_at","inputs","outputs","result","decisions","warnings","errors","retryable","tool_calls","runtime","publishing_enabled","real_production_enabled"],"properties":{
    "schema_version":{"type":"string"},"contract_id":{"type":"string"},"contract_version":{"type":"string"},"run_id":{"type":"string"},"case_id":{"type":"string","enum":["glass-river-writing-fixture"]},"stage":{"type":"string"},"attempt":{"type":"integer"},"idempotency_key":{"type":"string"},"status":{"type":"string","enum":["success"]},"started_at":{"type":"string"},"completed_at":{"type":"string"},"inputs":{"type":"array","minItems":2,"maxItems":2,"items":{"type":"object","required":["name","type","kind","path","sha256","size_bytes"],"properties":{"name":{"type":"string"},"type":{"type":"string"},"kind":{"type":"string"},"path":{"type":"string"},"sha256":{"type":"string"},"size_bytes":{"type":"integer"}},"additionalProperties":false}},"outputs":{"type":"array","maxItems":0,"items":{"type":"object","required":[],"properties":{},"additionalProperties":false}},
    "result":{"type":"object","required":["upstream_writer_handoff_hash","approved_claim_ids_seen","excluded_claim_ids_absent","factual_attribution_check","unsupported_material_check","redundancy_check","redundancy_findings","narrative_coherence_check","editor_decision","simulated_human_checkpoint_required","handoff_to_human_review","later_stage_requested","artifact_hashes","external_research_used","browser_used","mcp_used","network_used"],"properties":{
      "upstream_writer_handoff_hash":{"type":"string"},"approved_claim_ids_seen":{"type":"array","const":["SYN-RV-01","SYN-RV-02","SYN-RV-03"],"items":{"type":"string"}},"excluded_claim_ids_absent":{"type":"array","const":["SYN-RV-X1","SYN-RV-X2","SYN-RV-X3"],"items":{"type":"string"}},"factual_attribution_check":{"type":"string","enum":["passed"]},"unsupported_material_check":{"type":"string","enum":["passed"]},"redundancy_check":{"type":"string","enum":["passed"]},"redundancy_findings":{"type":"array","maxItems":0,"items":{"type":"string"}},"narrative_coherence_check":{"type":"string","enum":["passed"]},"editor_decision":{"type":"string","enum":["ready_for_human_script_review"]},"simulated_human_checkpoint_required":{"type":"boolean","enum":[true]},"handoff_to_human_review":{"type":"boolean","enum":[true]},"later_stage_requested":{"type":"boolean","enum":[false]},"artifact_hashes":{"type":"object","required":[],"properties":{},"additionalProperties":false},"external_research_used":{"type":"boolean","enum":[false]},"browser_used":{"type":"boolean","enum":[false]},"mcp_used":{"type":"boolean","enum":[false]},"network_used":{"type":"boolean","enum":[false]}
    },"additionalProperties":false},
    "decisions":{"type":"array","maxItems":1,"items":{"type":"object","required":["rule","result"],"properties":{"rule":{"type":"string"},"result":{"type":"string"}},"additionalProperties":false}},"warnings":{"type":"array","maxItems":0,"items":{"type":"string"}},"errors":{"type":"array","maxItems":0,"items":{"type":"string"}},"retryable":{"type":"boolean"},"tool_calls":{"type":"array","maxItems":0,"items":{"type":"object","required":[],"properties":{},"additionalProperties":false}},"runtime":{"type":"object","required":["provider","runtime","model","version"],"properties":{"provider":{"type":"string"},"runtime":{"type":"string"},"model":{"type":"string"},"version":{"type":"string"}},"additionalProperties":false},"publishing_enabled":{"type":"boolean","enum":[false]},"real_production_enabled":{"type":"boolean","enum":[false]}
  },"additionalProperties":false
}
